<!--Larsen u25004141-->
<?xml version="1.0" encoding="UTF-8" ?>
<schedule 
    xmlns:xsi="http://www.w3.org/2001/XMLSchema-instance"
    xsi:noNamespaceSchemaLocation="schedule.xsd">
    <COS210>
        <Code>COS 210</Code>
        <Name>Theoretical computer science</Name>
        <Semester>S1</Semester>
        <Lectures>
            <L1>
                <Day>Monday</Day>
                <Time>
                    <StartTime>11:30</StartTime>
                    <EndTime>12:20</EndTime>
                </Time>
                <Venue>
                    <Campus>Hatfield</Campus>
                    <Building>IT</Building>
                    <Room>2-26</Room>
                </Venue>
            </L1>
            <L2>
                <Day>Wednesday</Day>
                <Time>
                    <StartTime>08:30</StartTime>
                    <EndTime>09:20</EndTime>
                </Time>
                <Venue>
                    <Campus>Hatfield</Campus>
                    <Building>IT</Building>
                    <Room>2-26</Room>
                </Venue>
            </L2>
        </Lectures>
        <Tutorials>
            <T1>
                <Day>Friday</Day>
                <Time>
                    <StartTime>14:30</StartTime>
                    <EndTime>15:30</EndTime>
                </Time>
                <Venue>
                    <Campus>Hatfield</Campus>
                    <Building>IT</Building>
                    <Room>2-26</Room>
                </Venue>
            </T1>
        </Tutorials>
    </COS210>
    <COS212>
        <Code>COS 212</Code>
        <Name>Data structures and algorithms</Name>
        <Semester>S1</Semester>
        <Lectures>
            <L1>
                <Day>Monday</Day>
                <Time>
                    <StartTime>16:30</StartTime>
                    <EndTime>17:20</EndTime>
                </Time>
                <Venue>
                    <Campus>Hatfield</Campus>
                    <Building>Chemistry Building</Building>
                    <Room>Large Chemistry Hall</Room>
                </Venue>
            </L1>
            <L2>
                <Day>Wednesday</Day>
                <Time>
                    <StartTime>09:30</StartTime>
                    <EndTime>10:20</EndTime>
                </Time>
                <Venue>
                    <Campus>Hatfield</Campus>
                    <Building>Chancellor's Building</Building>
                    <Room>Louw hall</Room>
                </Venue>
            </L2>
            <L3>
                <Day>Thursday</Day>
                <Time>
                    <StartTime>16:30</StartTime>
                    <EndTime>17:20</EndTime>
                </Time>
                <Venue>
                    <Campus>Hatfield</Campus>
                    <Building>Chancellor's Building</Building>
                    <Room>Roos hall</Room>
                </Venue>
            </L3>
        </Lectures>
        <Tutorials>
            <T1>
                <Day>Friday</Day>
                <Time>
                    <StartTime>09:30</StartTime>
                    <EndTime>10:20</EndTime>
                </Time>
                <Venue>
                    <Campus>Hatfield</Campus>
                    <Building>Chancellor's Building</Building>
                    <Room>Louw hall</Room>
                </Venue>
            </T1>
        </Tutorials>
        <Practicals>
            <P1>
                <Day>Tuesday</Day>
                <Time>
                    <StartTime>09:30</StartTime>
                    <EndTime>12:20</EndTime>
                </Time>
                <Venue>
                    <Campus>Hatfield</Campus>
                    <Building>Informatorium</Building>
                    <Room>Purple Lab</Room>
                </Venue>
            </P1>
        </Practicals>
    </COS212>
    <COS216>
       <Code>COS 216</Code>
        <Name>Netcentric computer systems</Name>
        <Semester>S1</Semester>
        <Lectures>
            <L1>
                <Day>Monday</Day>
                <Time>
                    <StartTime>08:30</StartTime>
                    <EndTime>09:20</EndTime>
                </Time>
                <Venue>
                    <Campus>Hatfield</Campus>
                    <Building>IT</Building>
                    <Room>2-23</Room>
                </Venue>
            </L1>
            <L2>
                <Day>Tuesday</Day>
                <Time>
                    <StartTime>12:30</StartTime>
                   <EndTime>13:20</EndTime>
                </Time>
                <Venue>
                    <Campus>Hatfield</Campus>
                    <Building>IT</Building>
                    <Room>4-4</Room>
                </Venue>
            </L2>
            <L3>
                <Day>Wednesday</Day>
                <Time>
                    <StartTime>10:30</StartTime>
                    <EndTime>11:20</EndTime>
                </Time>
                <Venue>
                    <Campus>Hatfield</Campus>
                    <Building>IT</Building>
                    <Room>4-4</Room>
                </Venue>
            </L3>
            <L4>
                <Day>Thursday</Day>
                <Time>
                    <StartTime>09:30</StartTime>
                    <EndTime>10:20</EndTime>
                </Time>
                <Venue>
                    <Campus>Hatfield</Campus>
                    <Building>IT</Building>
                    <Room>4-4</Room>
                </Venue>
            </L4>
        </Lectures>
        <Practicals>
            <P1>
                <Day>Monday</Day>
                <Time>
                    <StartTime>13:30</StartTime>
                    <EndTime>16:20</EndTime>
                </Time>
                <Venue>
                    <Campus>Hatfield</Campus>
                    <Building>Informatorium</Building>
                    <Room>Maroon Lab</Room>
                </Venue>
            </P1>
        </Practicals>
    </COS216>
    <COS221>
        <Code>COS 221</Code>
        <Name>Introduction to database systems </Name>
        <Semester>S1</Semester>
        <Lectures>
            <L1>
                <Day>Monday</Day>
                <Time>
                    <StartTime>09:30</StartTime>
                    <EndTime>10:20</EndTime>
                </Time>
                <Venue>
                    <Campus>Hatfield</Campus>
                    <Building>IT</Building>
                    <Room>2-26</Room>
                </Venue>
            </L1>
            <L2>
                <Day>Wednesday</Day>
                <Time>
                    <StartTime>07:30</StartTime>
                    <EndTime>08:20</EndTime>
                </Time>
                <Venue>
                    <Campus>Hatfield</Campus>
                    <Building>IT</Building>
                    <Room>2-26</Room>
                </Venue>
            </L2>
            <L3>
                <Day>Thursday</Day>
                <Time>
                    <StartTime>11:30</StartTime>
                    <EndTime>12:20</EndTime>
                </Time>
                <Venue>
                    <Campus>Hatfield</Campus>
                    <Building>IT</Building>
                    <Room>4-4</Room>
                </Venue>
            </L3>
            <L4>
                <Day>Friday</Day>
                <Time>
                    <StartTime>10:30</StartTime>
                    <EndTime>11:20</EndTime>
                </Time>
                <Venue>
                    <Campus>Hatfield</Campus>
                    <Building>IT</Building>
                    <Room>4-4</Room>
                </Venue>
            </L4>
        </Lectures>
        <Practicals>
            <P1>
                <Day>Wednesday</Day>
                <Time>
                    <StartTime>11:30</StartTime>
                    <EndTime>14:20</EndTime>
                </Time>
                <Venue>
                    <Campus>Hatfield</Campus>
                    <Building>Informatorium</Building>
                    <Room>Blue Lab</Room>
                </Venue>
            </P1>
        </Practicals>
    </COS221>
    <INF272>
        <Code>INF 272</Code>
        <Name>Informatics</Name>
        <Semester>Y</Semester>
        <Lectures>
             <L1>
               <Day>Monday</Day>
                <Time>
                     <StartTime>12:30</StartTime>
                    <EndTime>13:20</EndTime>
                </Time>
                <Venue>
                    <Campus>Hatfield</Campus>
                    <Building>IT</Building>
                    <Room>4-4</Room>
                </Venue>
            </L1>
        </Lectures>
       <Practicals>
            <P1>
                 <Day>Tuesday</Day>
                <Time>
                   <StartTime>14:30</StartTime>
                    <EndTime>16:20</EndTime>
                </Time>
                <Venue>
                    <Campus>Hatfield</Campus>
                    <Building>Informatorium</Building>
                    <Room>Brown Lab</Room>
                </Venue>
            </P1>
        </Practicals>
    </INF272>
    <IMY210>
        <Code>IMY 210</Code>
        <Name>Advanced web technologies 1</Name>
        <Semester>S1</Semester>
        <Lectures>
            <L1>
                <Day>Wednesday</Day>
                <Time>
                    <StartTime>14:30</StartTime>
                    <EndTime>15:20</EndTime>
                </Time>
                <Venue>
                    <Campus>Hatfield</Campus>
                    <Building>IT</Building>
                    <Room>4-2</Room>
                </Venue>
            </L1>
            <L2>
                <Day>Friday</Day>
                <Time>
                    <StartTime>08:30</StartTime>
                    <EndTime>09:20</EndTime>
                </Time>
                <Venue>